Post Title,Comment,Upvotes,Timestamp,Tokenised_Comment,Manual_Label
Bogo bucket,It should but you cannot combine the 2 offers together.,1,2025-12-27 01:20:16,cannot combine offer together,Neutral
Fuck kfc it’s gotten expensive and bad,"Just because they are taught to make things the same at every franchise location, that doesn't mean the quality is always consistent. 

It should be, but human beings, you know. They can still fuck shit up.",2,2026-02-21 20:56:29,taught thing franchise location mean quality consistent human being fuck shit,Negative
Canadian kfc fries,"I go to mcd for my salted fries 

Whenever I can I try to grab those flavour mix shake packs when they offer them.

Something about dry seasoned fries > plain salted fries with fancy dip",1,2025-11-17 21:24:42,mcd salted fry whenever try grab flavour mix shake pack offer dry seasoned fry plain salted fry fancy dip,Negative
kfc job interview (NZ),"australia has it, its legit. 

some stores will not offer it, since maybe they don’t have a spot open",2,2026-01-22 06:16:35,australia legit store offer since maybe spot open,Positive
Starting a job at KFC next week and I have a couple of questions.,Oh great. Ty!,1,2025-10-15 21:36:59,great ty,Positive
First time trying KFC in 2026!! Five stars to the chicken of the 4 piece combo! :) 😋,The real question here is what did they charge ya?  KFC isn’t cheap these days and it’s far from its glory days. I’ll guess somewhere in the $10-15 range. I’ll pass.,1,2026-03-01 23:01:04,real question charge ya cheap day far glory day ill guess somewhere range ill pas,Neutral
How are they getting away with this?,the way mcdonalds gets away with insane prices. people keep paying for it,1,2025-06-04 00:52:48,mcdonalds get away insane price keep paying,Neutral
So cool,This is an only fans pic,1,2025-11-01 18:57:15,fan pic,Neutral
Found a glorious KFC Buffet in Georgia,i'm going there rn,2,2026-03-20 08:32:32,rn,Neutral
I know it has little in the name but damn,Hey I got a faint taste of kfc with this,6,2025-04-24 01:25:40,hey faint taste,Neutral
Would you pay $15 for this?,"No, that’s why I’m invested in copycattung these recipes",1,2026-02-17 01:56:35,invested copycattung recipe,Negative
My interview got cancelled 😞,Oh I don’t know what the one thing is. I just doubt it’s multiple things.,0,2025-06-01 17:39:26,doubt multiple thing,Neutral
PLEASE BRING THE TWISTER WRAP BACK TO MENUS IN THE USA,We still got it in Quebec :D my second fav item,1,2025-07-07 21:54:25,quebec second fav item,Neutral
BLESS.,Oh fuuck you’re gonna make me….,6,2025-08-13 00:45:48,fuuck gonna,Neutral
Shocked about KFC,I read that Yum! Is one of the biggest reasons minimum wage hasn’t gone up in a long time due to their lobbying so they wouldn’t have to pay workers more and make more profit. Everyone should hate them.,1,2025-04-24 10:36:41,read yum biggest reason minimum wage hasnt gone long due lobbying wouldnt pay worker profit hate,Neutral
So cool,"Oof, the Colonel on her pants is nightmare fuel.",13,2025-10-29 00:45:00,oof colonel pant nightmare fuel,Neutral
The piece of original recipe chicken I received…,“Which stank” got me XD,12,2025-12-23 09:53:42,stank xd,Neutral
Free 3 piece code worked for me today,Why would there be gravy for this? It’s tenders which come with regular dipping sauce,-1,2025-11-05 16:55:37,gravy tender come regular dipping sauce,Positive
How are they getting away with this?,Can’t even use tuff in the right slang…. Idiot,-1,2025-06-01 03:43:49,tuff right slang idiot,Neutral
KFC app sucks,The only problem I have is the food is hit or miss.,1,2025-11-12 01:34:51,food hit miss,Negative
Nothing beats KFC,I had Food Poisoning there last time. No thanks...,0,2026-03-17 00:10:26,food poisoning thanks,Negative
My Halloween Costume,"When I worked at KFC in the late 90's, our delivery driver (yes, we did delivery) looked like col. Sanders and was a retired colonel! He was one of our cooks dad.",5,2025-10-30 21:41:38,worked late delivery driver yes delivery looked col sander retired colonel cook dad,Neutral
DO NOT TRY THE 11:11 THING!!! I’M SCARED OUTTA MY MIND NOW,I somehow understood exactly what you meant,0,2025-10-24 00:28:39,somehow understood exactly meant,Neutral
I came I saw I conquered 7 portions of fry’s/chips what’s up with y’all,Naw man they are good,1,2025-12-07 07:05:01,naw,Positive
okay. fine..,You can't come back if you have a heart attack 💀,1,2025-07-08 16:24:49,come heart attack,Neutral
Please bring back the KFC buffet for 2026 or 2027 ASAP!,The KFCs in my neighborhood in Louisville had buffets until at least 2012. One of them even served fried boneless catfish. 😋,9,2026-01-28 22:58:25,neighborhood louisville buffet least served fried boneless catfish,Neutral
Oh KFC!,Tried this a few days ago.  Curds and fries were good but rubbery chicken.  ,1,2026-01-10 11:47:28,tried day curd fry rubbery chicken,Positive
"Dear god and all that’s holy, what the fuck happened to KFC Mac n cheese.",I came,1,2026-01-11 15:31:22,came,Neutral
"KFC made me pay to use the toilets even though I paid for a meal, what do I do?",Genius John over here,3,2025-07-24 14:01:51,genius john,Neutral
Hot wings are back on the menu!,That wings and wedges box is calling to me...,1,2025-08-22 01:57:37,wing wedge box calling,Neutral
I love KFC sooo much,What country is this from? I wish we had onion rings on the menu here in the US,9,2026-02-19 22:11:02,country wish onion ring menu u,Neutral
Kfc isnt good anymore,I’m Canadian and it’s $10.99 for the 2 piece original and $13.99 for the 2 piece chicken box meal on my app,1,2025-11-08 18:46:03,canadian piece original piece chicken box meal app,Neutral
How successful can this be,It really depends on how busy things are in that area..,1,2025-10-01 16:58:52,depends busy thing area,Neutral
My local store has had this printed sign for months now..,True I used to be able to shovel down anything and even I can barely eat kfc anymore. It seems like around 2011 quality there went to complete shit. In the early 2000s it wasn’t perfect but at least it was decent for fast food.,1,2026-01-03 07:55:43,true able shovel anything barely eat anymore seems around quality complete shit early wasnt perfect least decent fast food,Neutral
"Apparently, over here in the Dominican Republic, they're selling Dorito sandwiches...why?",Sounds delicious,1,2025-08-09 17:53:49,sound delicious,Positive
In witch country is the best KFC for you?,"Both our comments are lame. I was just being antagonistic for the sake of it, but even I cant take my last comment seriously. Your response was duly warranted ha",1,2026-03-24 01:34:46,comment lame antagonistic sake take comment seriously response duly warranted,Neutral
"Hey guys, Just wanted to ask a question about getting a Job at KFC.",Alright I'll look for some Mcdonalds jobs while I'm at it then,2,2025-07-09 03:24:52,alright ill mcdonalds job,Negative
"Never tried the famous bowl, what could this be?",What are the prices near you? I live in NYC and a famous bowl is $5.59.,2,2025-10-07 15:24:43,price near live nyc famous bowl,Neutral
Resignation,I wasnt really leading them on... but i see what you mean. It is reassuring to hear that i no longer have to worry about covering my shift. Thanks for replying,3,2026-02-01 11:59:33,wasnt leading mean reassuring hear longer worry covering shift thanks replying,Positive
KFC,"Lower prices = lower profits, now low quality   lol 

Fast food at one point in time use to be a good value for a decent meal - now it’s just way over priced for what it is which is why kfc is empty almost every time I drive by",1,2025-07-06 03:09:02,lower price lower profit low quality fast food value decent meal priced empty almost drive,Negative
Fuck kfc it’s gotten expensive and bad,"Hate to say it but KFC hasn’t been KFC in a long time, most fast food is garbage and should only be eaten in emergencies.",1,2026-02-26 03:13:14,hate hasnt long fast food garbage eaten emergency,Negative
Are you f’ing kidding me??!?,Just because people are stupid enough to buy a product doesn't mean it's not overpriced or of low quality,1,2025-12-05 21:25:26,stupid enough buy product mean overpriced low quality,Negative
"KFC menu on July 12, 2009",Back in the day when they still had the all u can eat buffet,1,2026-01-13 03:28:52,eat buffet,Negative
How long does it take for KFC to reply after you’ve submitted an application,"Tyyy!! i’m just wondering how were  you informed about the AI interview and how long did it take? because this is the last message they’ve sent me, ‘Hi! Thanks for your application. We're excited you want to join us! We're reviewing applications now and will be in touch soon.’",1,2025-08-10 08:13:13,tyyy wondering informed ai interview long take message theyve sent hi thanks application excited join u reviewing application touch soon,Positive
Classic Chicken Sandwich,"It's really pretty decent, just very plain, so I prefer to just get a plain one and dress it up differently as my mood dictates.",1,2025-12-12 02:59:33,decent plain prefer plain dress differently mood dictate,Neutral
KFC has the worst gravy ever,"The gravy up from KFC Canada literally tastes like salt and flour. I've tried it many times because I remember years ago it had more of a meaty/rich taste to it.

Mary Brown's gravy and Costco gravy is much better.",2,2025-11-19 22:22:02,gravy canada literally taste salt flour tried many time remember year meatyrich taste mary brown gravy costco gravy,Negative
"Never tried the famous bowl, what could this be?",Yummy!!!!!!,1,2025-10-08 07:22:49,yummy,Positive
Back when it was still finger lickin' good,Damn 15 pices is a lot for this price even in the 80s. How sad to see how its all played out over time.,4,2025-08-20 21:05:02,damn pices lot price sad played,Neutral
"Dear god and all that’s holy, what the fuck happened to KFC Mac n cheese.",I was only joking 💔 sorry,-6,2026-01-09 15:50:54,joking sorry,Neutral
Has anyone experienced this when ordering at a KFC?,Oh I definitely think it's weird as hell.,1,2025-08-28 09:41:24,definitely weird hell,Negative
Local KFC refused KFC gift card,"The manager should take it up with KFC Corporate then. Why are you on the side that the customer who bought a KFC gift card just gets fucked in this scenario?

Longer term, ok, this specific location wouldn’t take my gift card. I likely will never go back to this KFC ever again. Maybe I won’t go to any KFC ever again. 

Do you want repeat business? If not, ok. Just a real myopic view. ",1,2026-03-26 02:33:57,manager take corporate side customer bought gift card get fucked scenario longer term specific location wouldnt take gift card likely never ever maybe wont ever repeat business real myopic view,Negative
Can you have a wedding dinner in a KFC restaurant?,"If you want to pay $23,000 for a party of 15, sure.",2,2025-08-25 01:43:16,pay party sure,Neutral
"Today, the craving won",exactly !!! 6:30 am and a hour later it was found out it was a man we don’t even know  😭😭😭,1,2025-09-10 22:50:16,exactly later found,Neutral
I took full advantage of their free delivery promotion and got a order completely free 😎,"Yes. I'm doing nothing -- that nothing includes tipping. LOL thanks for your input. Certainly a meaningful addition to the dialogue.

You're supposed to use 2 dashes or an em dash between ""point"" and ""while"".

You came to spout off -- you left with a free grammar lesson. Lucky you.",2,2025-05-17 20:30:50,yes nothing nothing includes tipping thanks input certainly meaningful addition dialogue supposed dash em dash came spout left free grammar lesson lucky,Positive
Kfc workers,"It’s your location. Come on, you think it’s automatically like that everywhere? There is a franchise near me that has been great for decades. They updated the store numerous times so it always looks new. It shares a Taco Bell as well. The location near my brother’s home is in the city and has a bunch of losers working there who clearly don’t care about their job or the customers. He hates it.",5,2025-07-25 17:25:25,location come automatically everywhere franchise near great decade updated store numerous time look share taco bell location near brother home city bunch loser working clearly care job customer hate,Neutral
‘92 coupons,the 20 pc meal is 25? for that little? in Aus 25 is a standard boneless dinner,1,2025-11-12 08:47:49,pc meal little au standard boneless dinner,Negative
Somebody explain this to me.,"One has BBQ, the other one does not.",1,2025-11-02 18:30:13,bbq,Neutral
I took full advantage of their free delivery promotion and got a order completely free 😎,"airport distinct wine crush cows spoon summer cow disarm squeeze

 *This post was mass deleted and anonymized with [Redact](https://redact.dev/home)*",1,2025-05-16 20:53:19,airport distinct wine crush cow spoon summer cow disarm squeeze post mass deleted anonymized redact,Negative
This is a crock of crap,I went to a kfc the other day and the ac was out was 90 degrees inside not exaggerating. Asked the cashier how long it had been out and he said over a week,2,2025-08-06 00:09:12,ac degree inside exaggerating asked cashier long,Neutral
Kfc isnt good anymore,I agree n the food doesn’t have that original KFC flavor anymore,3,2025-11-05 21:45:08,agree food original flavor anymore,Negative
Is this normal,It is in the tenderloin ,1,2026-03-17 22:45:01,tenderloin,Positive
Is this normal for the Twisters?,Because I am seeking the correctly made item that I enjoyed growing up. I understand that the execution has been piss poor on each attempt and I assume that modern recipe for the item is at least remotely similar to the original item.,1,2026-03-26 03:34:36,seeking correctly made item enjoyed growing understand execution piss poor attempt assume modern recipe item least remotely similar original item,Negative
how tf am i supposed to not get burned,"having worked in the kitchen for awhile, although been retired for long time due to injury, you kinda just do. the kitchen is hot everywhere and you kinda learn to tolerate it. you both gain a pain tolerance to it and you become fast trying to avoid the pain. eventually you just kinda dont. helps irl i still frequently carry hot af things around cooking. oh i know a trick that helps but idfk how to translate it to text",2,2025-05-23 04:27:58,worked kitchen awhile although retired long due injury kinda kitchen hot everywhere kinda learn tolerate gain pain tolerance become fast trying avoid pain eventually kinda help irl frequently carry hot af thing around cooking trick help idfk translate text,Negative
Fuck this shit!,"Right? they take 30% from the restaurants, treat customers and drivers like shit",11,2025-06-20 23:30:14,right take restaurant treat customer driver shit,Negative
Is this cooked or undercooked,I don’t cook in my household,-1,2025-04-13 15:05:00,cook household,Neutral
Has anyone experienced being a part-timer and or a casual?,"luckily, so am I. Hours are flexible if you’re a casual but if you’re a part timer they will want a more regular schedule. You put in time off 1-3 weeks in advance it’s store dependent from experience. They’re pretty good about sick leave even on the day because they really don’t want sick people handling food. Also, I told my manager I can never work Mondays (I have obligations that day) and she’s very respectful of that. Overall, very store dependent

Summertime around Christmas is pretty busy as a lot of people are on holiday but the early bird gets the worm and the sooner you put in leave the more likely it is to be approved",1,2025-08-26 12:45:48,luckily hour flexible casual part timer regular schedule put week advance store dependent experience sick leave sick handling food told manager never monday obligation shes respectful overall store dependent summertime around christmas busy lot holiday early bird get worm sooner put leave likely approved,Positive
Found a glorious KFC Buffet in Georgia,Is there a way to save this in the Maps APP?,1,2026-03-24 12:04:55,save map app,Neutral
Tonight's dinner,"That's a healthy looking drumstick....but what are those other two scrawny things?? Regardless, that was kind of you! You're appreciated as well!",6,2025-09-23 02:43:41,healthy looking drumstickbut two scrawny thing regardless kind appreciated,Neutral
What da F****,So strange.  I guess that's why I don't work in that industry.,1,2025-12-23 04:36:33,strange guess industry,Negative
Is KFC getting worse over the years?,"People dont understand how to use touche properly...so I'll do it for them.

""Touche!""",1,2025-11-14 04:48:09,understand touche properlyso ill touche,Negative
I didn't like KFC food,"everyone told me that KFC went downhill in the 2010s

I really wanted to try the chicken once just to see how straneg it got",1,2025-10-16 03:52:40,told downhill wanted try chicken straneg,Negative
Went to KFC to get the Stranger Things Burger just to be told they don’t have it in stock,"I mean, we've now been served 2 of the stranger things burgers without the red buns, so that's absolutely not correct. That's the reason i found this thread",1,2025-12-31 21:12:44,mean weve served stranger thing burger without red bun absolutely correct found thread,Neutral
Finally got extra salt for my fries,Why am I not surprised KFC (I'm sure many others do this) has MSG in their salt?,1,2026-01-15 02:06:45,surprised sure many others msg salt,Positive
Cost of Large Coleslaw?,"LOL, I edited it. 

Here is the recipe for Sweet Restaurant Slaw.  I've made it many times and it always goes.  I cut back on the sugar to about half of what the recipe calls for,  but you can always add more.  

[https://www.allrecipes.com/recipe/142027/sweet-restaurant-slaw/](https://www.allrecipes.com/recipe/142027/sweet-restaurant-slaw/)",1,2025-11-26 20:03:24,edited recipe sweet restaurant slaw made many time go cut sugar recipe call add,Negative
Went to KFC to get the Stranger Things Burger just to be told they don’t have it in stock,Who goes to KFC just to get a branded version of a burger marked up at double the cost thats crazy 😂.,-9,2025-12-27 12:47:37,go branded version burger marked cost crazy,Negative
Update to my raw post,They are supposed to be made with 100% white breast meat.,2,2025-12-15 04:03:24,supposed made white breast meat,Neutral
Wtf?,This really does look just like kucka,1,2026-01-16 22:18:24,kucka,Neutral
"Apparently, over here in the Dominican Republic, they're selling Dorito sandwiches...why?",Not much else to look forward to over there.,1,2025-08-09 14:44:39,else forward,Neutral
The 7 dollar tender fill up that I ate earlier for lunch today. Really tasty and delicious!,skimp taters,1,2025-07-10 04:07:55,skimp tater,Neutral
No regular full fat Pepsi? WTF!?,"and they are still serving chicken  
just man-made chicken",1,2025-11-10 15:01:07,serving chicken manmade chicken,Neutral
Is that it? 🤣,Y'all can believe what you want. But I’ve had a messaged telling me to kill myself for making up a story which I think is even funnier. It ain’t that deep. ,0,2026-01-10 19:08:48,yall believe messaged telling kill making story funnier aint deep,Neutral
What da F****,$31.29 where I live,1,2025-12-23 04:55:43,live,Neutral
KFC is bringing back stuff from the 90’s. Hard.,"Bro The Colonel was alive back then so it’s probs gonna go hard AF. 

KFC from 50 years ago sounds wild. 😭",2,2025-10-04 15:51:15,colonel alive probs gonna hard af year sound wild,Neutral
Wedges?,wedges and popcorn chicken come back to me,1,2025-04-01 01:40:16,wedge popcorn chicken come,Neutral
What’s your all time fav KFC item?,Their BBQ Original Recipe in the 70's was amazing,2,2026-02-09 00:35:24,bbq original recipe amazing,Positive
£13:50 for this was pretty depressing,Haha I grew up with a single mom who did not make much and I'm 35. I just see fast food as a treat like I did as a kid. $13 sometimes isn't going to put me under. And I have ADHD so if I get a big portion of food I'm probably going to eat the whole thing. So I like to buy small portions.,1,2025-05-16 13:43:21,haha grew single mom fast food treat kid sometimes put adhd big portion food probably eat whole buy small portion,Negative
BLESS.,Now bring back the original in-house cookies you’d get with meals that came in the paper wrap and it will start to resemble what used to be good again.,1,2025-08-21 18:42:19,bring original inhouse cooky youd meal came paper wrap start resemble,Negative
BRING BACK THE 1$ SNACKERS (I’m Serious),LOL KFC is better anywhere else but in the US. It's even considered fine dining in some countries.,3,2025-10-20 06:08:46,anywhere else u considered fine dining country,Neutral
My local store has had this printed sign for months now..,"I reckon someone put the sign up one day out of necessity, finished their shift, and nobody has been out there since to notice the sign is still up. oops.",2,2026-01-02 22:46:15,reckon put sign necessity finished shift nobody since notice sign oops,Neutral
Unpopular opinion: kfc has the best tasting fried chicken among the big chain restaurants,This is true for the IK,1,2026-02-21 11:54:13,true ik,Neutral
Wtf?,"Slop is semi wet food usually made from leftovers (related to pig slops which are sloppy waste) so no, I wouldn’t describe dessicated looking kfc as “slop”. 
https://www.facebook.com/share/p/1BCkEQTHrj/?mibextid=wwXIfr",1,2026-01-19 00:43:43,slop semi wet food usually made leftover related pig slop sloppy waste wouldnt describe dessicated looking slop,Negative
Fuck this shit!,Why should I pay to have DoorDash deliver KFC to me? The Chinese place doesn’t charge me if I call them!,-1,2025-06-22 17:28:37,pay doordash deliver chinese charge call,Negative
"0.10 um molho ketchup,! Normal?","Vives em que planeta? KFC, pans, McDonald's 🤷🏻",1,2025-12-20 15:53:14,vives em que planeta pan mcdonalds,Neutral
KFC is trash and their prices are now offensive,Because KFC use to be fire. We're foolishly hoping they return to top form,1,2025-12-15 14:53:31,fire foolishly hoping return form,Negative
Do part time employees work closing shifts?,Got stuck 4-close on drive through my first week when everyone else usually gets morning lobby. My manager (now fired) also had me close the cold belt and tray on my own,1,2025-11-06 18:37:48,stuck close drive first else usually get morning lobby manager fired close cold belt tray,Neutral
Found a glorious KFC Buffet in Georgia,"https://share.google/CVXiBIz54XlESQ7eF
Oh shit it’s still there",1,2026-03-24 03:20:15,shit,Neutral
The $5 bowls are a good deal....,Is that the same price they charge for a la carte?,1,2026-01-31 07:27:47,price charge la carte,Neutral
Fuck kfc it’s gotten expensive and bad,The Jerk Store called..,2,2026-02-21 20:27:38,jerk store called,Neutral
Idk if this is allowed here.,Unfortunately fast food quality and service has taken a massive nosedive. ,4,2025-11-13 00:07:03,unfortunately fast food quality service taken massive nosedive,Negative
Is that it? 🤣,That's what KFC thinks and they are terrible,1,2026-01-10 20:35:22,think terrible,Negative
Are you f’ing kidding me??!?,"Order through the app and always select ""extra salt"" as a customisation. Can't go wrong",2,2025-12-02 00:00:24,app select extra salt customisation wrong,Negative
Does anyone order buckets anymore?,"In Canada we would sell a ton of individual meals for lunch, and a ton of buckets for dinner. The weekends, though, we would sell buckets all day.",5,2026-01-27 14:49:28,canada sell ton individual meal lunch ton bucket dinner weekend though sell bucket,Neutral
I took full advantage of their free delivery promotion and got a order completely free 😎,"skirt aromatic simplistic hunt quaint handle mountainous worm oil observation

 *This post was mass deleted and anonymized with [Redact](https://redact.dev/home)*",1,2025-05-17 06:44:00,skirt aromatic simplistic hunt quaint handle mountainous worm oil observation post mass deleted anonymized redact,Negative
What do you think is the worst position to work at KFC?,"BOH fs, I love FOH",4,2026-02-17 13:33:15,boh f love foh,Positive
Getting fired at KFC as cook was the best feeling ever,"It means you cook as many as you can fit in the fryer because it's busy and it will get sold. 

It wasn't that complicated man.",2,2025-10-27 09:27:31,mean cook many fit fryer busy sold wasnt complicated,Neutral
Is this a scam?,"It most likely is a scam because there’s just no way they are charging you extra just for all of that. It’s like the same thing with 7 eleven, they charged me an extra dollar just for a drink and yet it was only $1.59 and there’s no way they did that. These people are price gouging.",1,2025-04-27 22:44:54,likely scam there charging extra eleven charged extra dollar drink yet there price gouging,Negative
This was f*cking bomb af,"KFC gravy is the only thing I miss about working there.  I would just fill a mashed potato bowl of wedges and pour some of that brown gravy over the top.

Glad I was young when I worked there and was on my feet 10 hours a day.",3,2025-06-07 08:27:01,gravy miss working fill mashed potato bowl wedge pour brown gravy glad young worked foot hour,Positive
Kfc isnt good anymore,I haven't seen kfc look that good in years. It's always way darker (probably dirty oil and overcooked).,1,2025-11-06 14:05:57,seen year darker probably dirty oil overcooked,Negative
