Post Title,Comment,Upvotes,Timestamp,Tokenised_Comment,Manual_Label
Have they changed it or did I just have a bad batch?,"There’s been no change to process for fries or chicken in last year.
Chicken has been the same for a long time.

Seasoning on fries is down to how much the seasoning clicker is clicked.
Someone may have gone overboard with it.",1,2025-05-31 17:22:03,there change process fry chicken chicken long seasoning fry seasoning clicker clicked may gone overboard,Neutral
My local store has had this printed sign for months now..,It's not like some of the items will be less than posted on the menu. It'll always be more. Which is why someone needs to phone them and raise hell. The fact it is illegal in your country makes doing nothing even more inexcusable...,1,2026-01-07 11:27:36,item less posted menu itll need phone raise hell fact illegal country make nothing inexcusable,Neutral
Local KFC refused KFC gift card,Kfc was doing their gift card program in house. They decided it would be cheaper to outsource it. So every kfc had to update their credit/debit pinpad terminals to accommodate the new vendor. This knocked out the capability to accept any of the other (older) cards. It was really dumb and I hear it’s a nightmare for cashiers.,3,2026-03-25 22:54:20,gift card program house decided cheaper outsource update creditdebit pinpad terminal accommodate vendor knocked capability accept older card dumb hear nightmare cashier,Negative
I think I live near one of the worst kfc,I hope you’re not a babysitter out of respect for MJ,3,2025-11-11 13:19:22,hope babysitter respect mj,Neutral
‘92 coupons,"In my country we were paying $10.80 usd equivalent all tax included for a 10 piece bucket and choice of 4 large sides eg Fries, Potato & Gravy, 1.5 litre Coke etc..... Same deal at today's local prices converted to USD $26.13",1,2025-11-15 05:11:46,country paying usd equivalent tax included piece bucket choice large side eg fry potato gravy litre coke etc deal today local price converted usd,Neutral
Can you ask for just the chicken breast pieces or is that frowned upon?,"You can request absolutely, but they can't guarantee. In the UK we get 2 bags of chicken and those contain:
White bags- 4x legs, 4x thighs, 4x ribs, 4x wings and 2x breast.
Dark- 14 x leg and 4 x thighs.
They will try their best but breast is a very requested piece meaning it may not always be available/ may have to wait on the next batch.",1,2025-06-19 16:04:30,request absolutely guarantee uk bag chicken contain white bag leg thigh rib wing breast dark leg thigh try best breast requested piece meaning may available may wait next batch,Positive
NOOOOOOO,I call KFC Land of the clone cluck 😂😂😂,1,2025-08-27 20:04:14,call land clone cluck,Neutral
This is a crock of crap,Taco bell does this. I get a large drink and it's 95% ice. The one time I drank it and I had a can in my car so I refilled and the 12oz can couldn't fit in the large cup. Now if I order a drink at any fast food I get no ice.,1,2025-08-03 05:18:43,taco bell large drink ice drank car refilled oz couldnt fit large cup drink fast food ice,Neutral
KFC in Philippines has Popcorn Chicken. Why not USA?,We have fried KFC batter aka Popcorn Chicken in Canada too. You're not missing anything tbh lol,1,2025-09-17 23:51:02,fried batter aka popcorn chicken canada missing anything tbh,Neutral
$10 for all these (US),I think today is the last day for that deal.,1,2025-12-21 22:53:32,deal,Neutral
Shifts feel soooo long,"I’m FOH most of the time, so the customers kinda entertain me with the amount of bullshit that happens, also just talking to co workers and such",2,2025-06-12 07:59:20,foh customer kinda entertain amount bullshit happens talking co worker,Negative
Does anyone order buckets anymore?,If you order buckets from uk KFCs now it seems to be the bucket amount but in little bags. Not so fun.,1,2026-01-28 11:47:50,bucket uk seems bucket amount little bag fun,Neutral
Is there any way to get more than 6 regular legs like I did a month ago? They seem to be capping me at 6 legs now. Or is there a bucket with only legs or something?,Honestly its probably because the new promotion is such a huge mess. People have been ordering 12+ solo items dunked in BBQ sauce since they cant get family meals like so.  They probably capped out the chicken to try to avoid loopholes.,1,2025-10-26 17:19:10,honestly probably promotion huge mess ordering solo item dunked bbq sauce since family meal probably capped chicken try avoid loophole,Negative
Would you pay $15 for this?,"No actually, because I don’t own any dollars",1,2026-02-16 20:57:44,dollar,Neutral
Ordered flaming wrap with hash brown and this is what I got,Looks about right for kfc the only place I hate more then McDonald’s,1,2025-12-19 14:14:51,look right hate mcdonalds,Negative
This is a crock of crap,"Oh, my b, the kfc/taco bell in broadheadsville",1,2025-08-03 20:46:11,kfctaco bell broadheadsville,Neutral
Potato Wedges Return on 8.18,Can't wait to see how they've packed chemicals into a simple potato.,1,2025-08-11 16:47:16,wait theyve packed chemical simple potato,Negative
Bring back popcorn chicken you cowards!!!!!,You're joking right they do have it never got rid of it,1,2025-06-10 20:20:29,joking right never rid,Negative
Is USA kfc better then UK kfc?,American KFC is so bad that they've lost the industry they created,7,2025-07-06 18:50:54,american theyve lost industry created,Negative
What do you think is the worst position to work at KFC?,Doggy style,2,2026-02-18 19:50:07,doggy style,Neutral
Thought it was a joke🫩 seen at target 🫩,or even the free colonel sanders dating sim vn,2,2026-03-11 20:02:00,free colonel sander dating sim vn,Neutral
Why KFC doesnt advertise their 11 secret herbs and spices anymore?,The ratio might have been a secret but I think at this point food scientists have figured it out and it must be well known,3,2025-05-28 12:26:46,ratio secret food scientist figured must known,Neutral
KFC is getting Greedy with their coupons,KFC is nothing more than a remnant of a better time. This place wont recover and will be gone soon enough.,1,2025-12-02 11:52:45,nothing remnant wont recover gone soon enough,Negative
Kfc workers,"Nah, that person believes that an entry level position mean you deserve the worst of the worst. Bad pay, horrible customers, cats afford to live and have a bleak life until you find a way out. Boomer probably who bought their house for 30k.",1,2025-07-26 00:25:30,nah belief entry level position mean deserve worst worst pay horrible customer cat afford live bleak life find boomer probably bought house,Negative
Why is no one talking about this?,"In some places, like Australia, anything on a round bun is considered a ""burger."" ",5,2026-03-21 22:04:38,place australia anything round bun considered burger,Neutral
Felt cheated,"in my experience the ad picture of the food is just a ""idealized/perfect"" version and the actual product should look at least somewhat similar, but nothing like this",1,2026-03-16 05:22:48,experience ad picture food idealizedperfect version actual product least somewhat similar nothing,Positive
Kfc workers,Teens and young adults can be used to your advantage if you talk with them and they like you. Then they hook you up. In fact they seem to like being appreciated and respected and they will give it back. Many times with free food or just giving you things made fresh. It works for me all the time.,1,2025-07-26 01:15:06,teen young adult advantage talk hook fact seem appreciated respected give many time free food giving thing made fresh work,Neutral
No regular full fat Pepsi? WTF!?,"American Cancer Society  
Aspartame and Cancer Risk

In general, the American Cancer Society does not determine if something causes cancer (that is, if it is a carcinogen), but we do look to other respected organizations for help with this.

World Health Organization (WHO)  
International Agency for Research on Cancer (IARC)

IARC is the cancer research agency of the WHO. One of its major roles is to identify causes of cancer.

IARC classifies aspartame as “possibly carcinogenic to humans” (Group 2B), based on limited evidence it might cause cancer (specifically liver cancer) in people. IARC also notes there is limited evidence for cancer in lab animals and limited evidence related to possible mechanisms for it causing cancer.

It’s important to know that IARC classifications are based on the strength of the evidence of whether something can cause cancer in humans, not how likely it is to cause cancer. The Group 2B classification is the third highest out of 4 levels, and it is generally used either when there is limited, but not convincing, evidence for cancer in humans, or when there is convincing evidence for cancer in lab animals, but not both.

//////

National Institutes of Health (.gov)

Soft drinks, aspartame, and the risk of cancer and cardiovascular disease

by D Aune · 2012 · Cited by 35 — Schernhammer et al found that among men greater intake of diet sodas (≥1 serving/d) was associated with an increased risk of non-Hodgkin lymphoma 

These 3 studies add to a growing body of evidence on the adverse health effects of soft drinks; however, given the limited and conflicting data available, these findings can at the present time be considered only suggestive, not conclusive, but they warrant further investigation in other prospective studies with data on long-term intake of soft drinks, diet soft drinks, and aspartame.

//////

its always been controversial",5,2025-11-10 14:41:49,american cancer society aspartame cancer risk general american cancer society determine cause cancer carcinogen respected organization help world health organization international agency research cancer iarc iarc cancer research agency major role identify cause cancer iarc classifies aspartame possibly carcinogenic human group based limited evidence cause cancer specifically liver cancer iarc note limited evidence cancer lab animal limited evidence related possible mechanism causing cancer important iarc classification based strength evidence whether cause cancer human likely cause cancer group classification third highest level generally either limited convincing evidence cancer human convincing evidence cancer lab animal national institute health gov soft drink aspartame risk cancer cardiovascular disease aune cited schernhammer et al found among men greater intake diet soda servingd associated increased risk nonhodgkin lymphoma study add growing body evidence adverse health effect soft drink however given limited conflicting data available finding present considered suggestive conclusive warrant investigation prospective study data longterm intake soft drink diet soft drink aspartame controversial,Positive
Am i gay if i eat this,"you're gay anyway, this has nothing to do with it",1,2025-06-01 19:09:08,gay anyway nothing,Neutral
KFC False Advertising Australia?,"At first I was like, why is op showing us three pieces of bacon? Than I looked closer… oh..",1,2025-04-25 06:07:26,first showing u three piece bacon looked closer,Neutral
decided to get the nashville tenders aaaaaand received this….,thats actually nasty i would ask for a refund YUCK!,1,2026-03-20 00:14:28,nasty ask refund yuck,Negative
Wtf kfc!!,I don't order KFC for a good deal I order it for the grool,1,2025-04-18 07:55:07,deal grool,Negative
What would you guys like to see in Australia's menu?,Fried kangaro,2,2025-08-10 15:26:59,fried kangaro,Neutral
This is the current state of a zinger burger....,It wasn't my choice. Daughters bday.,1,2026-02-28 21:36:32,wasnt choice daughter bday,Neutral
Is it just me or is KFC gone,Where do you live? I just looked and famous bowls are $5.79 on KFC app and $6.49 for a combo.,1,2025-05-18 15:59:35,live looked famous bowl app combo,Neutral
KFC in Philippines has Popcorn Chicken. Why not USA?,"terrible, terrible",1,2025-09-17 17:00:45,terrible terrible,Negative
Who uses the KFC Rewards app and Fills out the Surveys for Discounts?,I only buy kfc on tuesdays,1,2025-05-29 17:56:50,buy tuesday,Neutral
KFC App,"All they wanted was a Pepsi. Just one Pepsi, and they wouldn't give it to them.",-2,2025-07-07 01:11:35,wanted pepsi pepsi wouldnt give,Neutral
Worker representing KFC with a Confederate flag hat,"As someone who grew up in the deep south, yes it is. It’s not heritage when the confederacy lasted not even as long as half of Taco Bell’s limited time menu options. The confederacy existed purely because the South was mad they couldn’t have slaves, which is an extremely racist position. And before you say it was “states rights”, it was for states’ rights to do what? Oh yeah, have slaves. Explain how that isn’t racist",1,2025-07-24 20:09:51,grew deep south yes heritage confederacy lasted long taco bell limited menu option confederacy existed purely south mad couldnt slave extremely racist position state right state right slave explain racist,Negative
Are you f’ing kidding me??!?,"*buys fast food that’s been over rated and over priced for years whilst knowing somehow the exact cost per pound of russet potatoe* :shock at price ?!??!? 😱😱😱🤯🤯🤯🤯🤯🤯😱🤯😱😱😱😱😱😱.

You people who eat that shit are so funny to me. Like why it doesn’t save money or time. The only time you should ever eat out is.

For fun with family&friends, if you’re too intoxicated and need too door dash, If you’ve had a major operation and cannot cook. There’s probably another reason but… you could also support a mom n pop shop with better prices and portions (and food quality/cleanliness) 😚",1,2025-11-30 23:06:44,buy fast food rated priced year whilst knowing somehow exact cost per pound russet potatoe shock price eat shit funny save money ever eat fun familyfriends intoxicated door dash youve major operation cannot cook there probably another could support mom pop shop price portion food qualitycleanliness,Negative
Wtf?,Their chicken tenders are more like nuggets. Maybe even smaller. Total rip-off.,1,2026-01-18 19:56:04,chicken tender nugget maybe smaller total ripoff,Negative
Uhh… is this a glitch?,More 6head as a cook id probably just do 16head to not run out,1,2025-10-22 02:48:34,head cook probably head run,Neutral
Pickup Order,"I went to the email, scrolled down to the bottom below the order details, “having issue with your order? Contact us”, clicked that, it takes you to a page where you can fill out a ticket, call them or chat with the assistant. It’ll be an ai, but you can get it to connect you with a human representative. Explain you’ve been trying to contact them and see if they’ll process a refund.",2,2026-01-14 20:24:00,email scrolled bottom detail contact u clicked take page fill ticket call chat assistant itll ai connect human representative explain youve trying contact theyll process refund,Negative
Inquiry about time off,"Ideally, you should have told them about this during the hiring process so they can accomodate. But you should tell them now and see what they do. I doubt they would want to rehire. They'll just start looking for someone else to replace you.",6,2025-10-23 05:07:06,ideally told hiring process accomodate tell doubt rehire theyll start looking else replace,Neutral
Is this normal,"But being understaffed isn't the customer's issue. As the other post suggested that customers should tidy up, how would that be done? Not my job to tidy up due to the store's management's own incompetence.",2,2026-03-18 23:29:20,understaffed customer post suggested customer tidy done job tidy due store management incompetence,Negative
Found a glorious KFC Buffet in Georgia,Surely this can’t be profitable 🤣,1,2026-03-21 00:23:33,surely profitable,Neutral
Hot Wings or Original Piece Chicken? Not a boned chicken eater,"In the US, they always ask if you want original recipe or extra crispy.  They don't do that in the UK?  They only have the original recipe?

In any case, I'd go with the hot wings if I were you.  You said you don't like big pieces that are slimy on the inside, and wings are small and more likely to be ""dry.""",1,2025-11-11 20:20:12,u ask original recipe extra crispy uk original recipe case hot wing big piece slimy inside wing small likely dry,Positive
Get a grip KFC,In UK we get a 20 wings for just over $10 they run promotion like 3 times a year.,1,2026-02-14 13:32:02,uk wing run promotion time,Neutral
What are these locations? Most of them are combos,Denny's Applebee's Max,1,2026-01-24 10:12:36,dennys applebees max,Neutral
Found these at Dollar General!,I bet. And after the sell out bevel coming back. Eeeeyyuuuccccckkkk,2,2026-02-17 19:17:32,bet sell bevel coming eeeeyyuuuccccckkkk,Neutral
What's your go-to order?,"I haven't been to KFC since before they discontinued the Spicy Famous Bowl, and I'm wondering if I should try something new, or just throw some habanero sauce in a regular famous bowl.",1,2026-01-14 00:36:28,since discontinued spicy famous bowl wondering try throw habanero sauce regular famous bowl,Neutral
kfc shrinkflation,Honestly you should have reported that to corporate. Thats not shrinkflation thats just a bad employee and manager not doing their jobs correctly. Thats a sad excuse for food that should have never gone out to a paying customer.,1,2025-09-30 13:34:43,honestly reported corporate shrinkflation employee manager job correctly sad excuse food never gone paying customer,Negative
KFC now serves tacos and a bubble gum shake with popping rocks (image taken on a first gen iPhone),And Taco Bell has chicken nuggets. The world’s upside down.,4,2025-07-01 20:37:43,taco bell chicken nugget world upside,Neutral
Please bring back the KFC buffet for 2026 or 2027 ASAP!,Maybe it was a combination long John silvers/ kfc,2,2026-01-29 09:21:07,maybe combination long john silver,Neutral
BRING BACK THE 1$ SNACKERS (I’m Serious),😋 delicious yummy I love kfc,1,2025-10-20 08:53:26,delicious yummy love,Positive
KFC Korea has beer menu!,If you can call it that.,1,2025-11-19 01:39:51,call,Neutral
KFC Chicken Sandwich isn’t bad at $3.99 if it’s fresh.,"That's the thing with KCF. You gotta get it when its fresh. That's why any time I go, its right when it opens",1,2025-08-23 21:36:42,kcf gotta fresh right open,Neutral
Wtf kfc!!,"If you’re ignorant and order like this, maybe. No different than any other fast food. If you get very specific things like this it’s expensive, but if you know what to order, you can get the same amount of food for half the price",6,2025-04-18 07:49:16,ignorant maybe different fast food specific thing expensive amount food price,Negative
Is kfc real chicken,Made me LAUGH🤣🤣🤣,2,2025-05-18 16:22:26,made laugh,Negative
Order Cancellation at very last moment,lol in no mannerism does my response insinuate I’m not “chill”,1,2025-10-11 11:08:36,mannerism response insinuate chill,Neutral
Eye popping prices!,"Pro tip and maybe unethical life hack but if you find anything wrong with your order take picture and email them to customer service and they will usually give you free food vouchers.

I complained about the size of my chicken being way to small and they gave me a £10 voucher.

Works with most fast food places",1,2025-08-03 12:27:45,pro tip maybe unethical life hack find anything wrong take picture email customer service usually give free food voucher complained size chicken small gave voucher work fast food place,Negative
When free chicken is a nightmare. BEWARE!,I used this deal last night. Food was ready in like 8 min. They gave me extra sauce dips.,2,2025-07-17 00:42:34,deal night food ready min gave extra sauce dip,Neutral
Uhh… is this a glitch?,Ikr!,1,2025-10-22 20:55:07,ikr,Neutral
Are you f’ing kidding me??!?,"I agree 💯 
This world seems to be full of folks who are extremely insecure or just looking for a reason to be offended 🤦‍♀️
I must have some dam thick skin cuz I’m rarely IF EVER offended by mere words",2,2025-12-02 12:07:11,agree world seems full folk extremely insecure looking offended must dam thick skin cuz rarely ever offended mere word,Neutral
Anybody familiar with the Big Filler Jalapeño?,I want that in my face.,2,2026-01-21 19:06:57,face,Neutral
Zinger Sandwich is back on the menu in the US!,Who else would rather see chicken littles come back for $1.79?,1,2026-01-12 14:54:03,else rather chicken little come,Neutral
Good grief what happened?!,Pizza Hut and kfc owned by the same company lol,18,2025-11-19 04:38:05,pizza hut owned company,Neutral
I took full advantage of their free delivery promotion and got a order completely free 😎,You're right. And usually these people film themselves or get filmed in some way doing shit to things at the stores. Cops will not give a shit about someone claiming their delivery was opened. It can very easily be lied about and on top of that. Cops don't care.,-2,2025-05-16 20:30:32,right usually film filmed shit thing store cop give shit claiming delivery opened easily lied cop care,Negative
KFC played themselves with the Wedges,It was a huge letdown. Mine were soggy and not good at all.,1,2025-08-21 12:51:20,huge letdown mine soggy,Negative
This 10 piece Chicken bucket must be a piss take. 8 Drumsticks...,They took my kfc and Taco Bell and turned it into an Arby’s,1,2025-07-06 17:46:18,took taco bell turned arbys,Neutral
"Two Spicy Crispy Sandwiches, mashed potatoes, one Spicy Chicken piece, and a Pepsi",This would cost over $35USD in my country,3,2025-08-30 06:30:43,cost usd country,Neutral
What Is Your Favorite Thing To Get From KFC?,Anything they made 30+ years ago. Now it’s all greasy tasteless crap,1,2025-11-22 01:04:11,anything made year greasy tasteless crap,Negative
Are the kfc caps washable?,I use cold water I’m not sure if ur supposed to tho,2,2025-10-25 01:15:26,cold water sure supposed tho,Negative
How?,You can eat for 3 quid what working man can’t afford that?,1,2025-12-06 17:01:36,eat quid working afford,Neutral
This review was humourously sad,"Most kfcs are bad, my local one closed cause of the reviews lol",2,2025-11-26 00:46:30,local closed cause review,Negative
Do people actually like Double Down?,Man if I went to Switzerland I don’t think I’d even go near a kfc. I don’t even care for the US version compared to other options,1,2026-01-16 17:50:54,switzerland near care u version compared option,Neutral
What do you think is the worst position to work at KFC?,Restroom attendant,1,2026-02-17 23:31:57,restroom attendant,Neutral
Are wedges temporarily back?,"They taste exactly like they used to, maybe you got a bad batch",1,2025-08-31 16:55:16,taste exactly maybe batch,Negative
Unpopular opinion: kfc has the best tasting fried chicken among the big chain restaurants,KFC is my favorite the few times I eat fast food.,1,2026-01-25 16:14:04,favorite time eat fast food,Positive
Are you f’ing kidding me??!?,im laughing at you too 🤣,1,2025-12-01 00:37:53,laughing,Neutral
Sweet lighting?,The only reason go to kfc anymore,2,2025-08-07 07:31:51,anymore,Neutral
I took full advantage of their free delivery promotion and got a order completely free 😎,"It is not, nor has it ever been, a requirement to tip as a customer. That’s literally all a made up moral high ground people take out of laziness towards fixing the problem with wages.

It is on the employer to pay their employees 100% of the time. It is on the consumer to pay the employer for their products and services. 

“Delivery fee” is a fake fee that didn’t exist until employers realized it was free money they could require from customers without passing it on to their drivers, when it should have been given to drivers from the start to remove this stupid moral high ground people take saying you must tip. 

As much as I hate to say it, the reality is that this will always be an issue of people not being paid enough as both server and driver until people stop paying tips and people stop driving/serving, forcing employers to pay fair wages to them. 

I didn’t create the situation, and I know people won’t unite to fix it anytime soon, so I choose to tip my servers/drivers so long as they aren’t rude -but I am never required to and neither is anyone else.",1,2025-05-17 09:24:12,ever requirement tip customer literally made moral high ground take laziness towards fixing wage employer pay employee consumer pay employer product service delivery fee fake fee exist employer realized free money could require customer without passing driver given driver start remove stupid moral high ground take saying must tip hate reality paid enough server driver stop paying tip stop drivingserving forcing employer pay fair wage create situation wont unite fix anytime soon choose tip serversdrivers long arent rude never required neither else,Negative
My interview got cancelled 😞,"Like, I noticed they applied before they pick an interview slot.",1,2025-06-02 13:19:39,noticed applied pick interview slot,Neutral
Do you feel that KFC has an especially noticeable consistency problem? (The problem being: inconsistency.),The Double Down with Xtra sauce,1,2026-02-24 03:55:16,xtra sauce,Neutral
Egyptian KFC is goated,Before they got them people would fly down with many buckets and trade them for coke,1,2026-02-14 07:40:26,fly many bucket trade coke,Neutral
Why is no one talking about this?,"Do you guys have the wraps? Really love them. 

https://www.kfc.co.uk/our-menu/twisters",1,2026-03-22 08:44:26,wrap love,Positive
My local KFC asked if I wanted bacon with my ice cream,Yes please. Everything is better with bacon.,1,2025-12-09 22:08:48,yes please bacon,Neutral
