Post Title,Comment,Upvotes,Timestamp,Tokenised_Comment,Manual_Label
Please bring back the KFC buffet for 2026 or 2027 ASAP!,"I honestly can't believe they took it away I used to work there back in the day and on Sundays I can't remember the sales for the total day but it was in the thousands and I'm talking over 5K. 

It was surprisingly easy to keep it up. The lunch Church crowd in the evening church crowd plus everybody else made for a busy day. 

I will say my local KFC has a sign that says buffet coming soon.",3,2026-01-29 16:14:59,honestly believe took away sunday remember sale total thousand talking surprisingly easy keep lunch church crowd evening church crowd plus everybody else made busy local sign say buffet coming soon,Negative
No regular full fat Pepsi? WTF!?,What is full fat Pepsi?,4,2025-11-10 13:10:15,full fat pepsi,Neutral
Why does no one like to work the headset?,I know right like my managers don’t care if I’m on my phone when they’re aren’t any cars so I just stand there most of the time on my phone,1,2025-06-16 14:00:19,right manager care phone arent car stand phone,Neutral
Bring back the KFC Mega Jug in the era of DoorDash/Uber Eats/GrubHub delivery!,"1. Anyone can drink as much soda as they want. All I'm saying is that if you're drinking a 2 liter worth of soda in one day by yourself, you should seriously consider altering your life choices.

2. Yes, if 3-4 were sharing this cup of soda, that would be an acceptable reason to get it. I did not think of people sharing it.

3. I was not the original person that made the comment about diabetes.",1,2026-02-01 04:11:37,drink soda saying drinking liter worth soda seriously consider altering life choice yes sharing cup soda acceptable sharing original made comment diabetes,Neutral
What happened to the fries?,Just goes to show theyd rather make a quick buck than really give their core audience the quality they deserve.,3,2025-04-29 05:18:38,go show theyd rather quick buck give core audience quality deserve,Neutral
"Hey guys, Just wanted to ask a question about getting a Job at KFC.","in my interview i had it 2 weeks ago and got the job, they just asked about like my strengths and weaknesses and why im good in a team environment and why i should be hired. It also varies for other stored, I had another inverview yesterday for a different kfc and their questions were different than the first kfc's. Anyway goodluck.",1,2025-07-09 09:11:24,interview week job asked strength weakness team environment hired varies stored another inverview yesterday different question different first anyway goodluck,Positive
Serious question: Do people actually prefer the new Famous Bowls?,They just suck now. Heck there are frozen famous bowls that are way better like stouffers or banquets. They just lack cheese but are way cheaper.,1,2026-02-22 19:19:59,suck heck frozen famous bowl stouffers banquet lack cheese cheaper,Negative
Just got hired but no shifts appeared in lifelenz and no one has got in contact with me,"i sorta had this experience but once i put in my availability my shifts started coming in.

ps, as a new worker, you might not get a lot of shifts often, depends on your manager and what country you work in (I work in australia)",1,2025-07-18 00:49:17,sorta experience put availability shift started coming p worker lot shift often depends manager country australia,Neutral
How?,"Same place you’re claiming it’s $9.95, Canada",1,2025-12-06 19:31:16,claiming canada,Neutral
Hot wings are back on the menu!,"These were the amazing ones...

[https://www.youtube.com/watch?v=eqkjP5JQ1CQ](https://www.youtube.com/watch?v=eqkjP5JQ1CQ)

Used to eat them when I got my first apartment and KFC was beside my old workplace.",2,2025-10-08 03:12:11,amazing one eat first apartment beside old workplace,Positive
Thought it was a joke🫩 seen at target 🫩,"I've eaten these, and they are gross!",2,2026-03-11 17:20:42,eaten gross,Negative
The $5 bowls are a good deal....,Fuck that. Just get too bowls.,1,2026-01-31 23:04:34,fuck bowl,Negative
I dont know if its inflation or me just going crazy. But this small combo meal costed me almost 16$. Including fountain drink.,Where in the hell do you live and get 8 pieces for $10?????,1,2025-10-22 13:57:10,hell live piece,Neutral
Found these at Dollar General!,"Yeah now that you bring it up it would literally be a less buttery version of that one. So not awful. 


The other ones? Disgusting. ",1,2026-02-18 01:13:01,bring literally less buttery version awful one disgusting,Negative
Crazy Monday/Tuesday/Wednesday/... promotion Which day is it in your region?,"In USA it's called the ""crazy if you eat at KFC"" promo",2,2025-06-02 02:35:53,usa called crazy eat promo,Neutral
I love KFC sooo much,It doesnt love you. Babies,1,2026-02-22 03:36:21,love baby,Neutral
Kfc workers,This narrative is getting real old.  It’s an entry level position. No one is paying top dollar for an entry level job. This is for job experience.,2,2025-07-25 18:12:37,narrative getting real old entry level position paying dollar entry level job job experience,Neutral
I miss the wedges and popcorn chicken.,Ask for them fresh,1,2026-01-11 13:49:47,ask fresh,Neutral
long hair as a guy,"I mean while at work, everyone, no matter if male or female has to wear their hair tied up anyway. Anyone who is entering the kitchen has to have it in a bun and/or a hair net and a cap on. But if they would have told him so on induction anyway if they would have wanted to hire him.",1,2025-11-08 17:55:36,mean matter male female wear hair tied anyway entering kitchen bun andor hair net cap told induction anyway wanted hire,Neutral
Kfc isnt good anymore,Hasn’t been good for years,2,2025-11-07 12:42:35,hasnt year,Positive
Found this crazy joint restaurant (sorry you couldn’t see the other restaurant in the other photo),These are in Colorado as well,1,2025-04-22 22:37:31,colorado,Neutral
Are you f’ing kidding me??!?,"You're literally generalizing an entire group to be ""lesser than"" yourself, that is racism and oppression dummy.",1,2025-12-02 18:05:41,literally generalizing entire group lesser racism oppression dummy,Neutral
KFC,Eats fast food and questions ingredients quality,1,2025-12-29 21:59:12,eats fast food question ingredient quality,Neutral
What’s your all time fav KFC item?,In the UK they used to have the big daddy burger that was great,1,2026-02-09 07:16:30,uk big daddy burger great,Negative
Can someone tell me if my gravy is meant to look like this?,Worked at KFC. Just means that the product expired and they added a new time rather than throwing it out. Gravy has a certain shelf life after it’s made before it’s thrown away (think it was 8 hours from memory) - It’s fine to consume but is not within the companies guidelines as should be thrown out and a new batch made,6,2025-04-14 12:48:50,worked mean product expired added rather throwing gravy certain shelf life made thrown away hour memory fine consume within company guideline thrown batch made,Neutral
Why can’t we combine two deals together and what is the best deal? Tender or Bucket?,You have to pay for sauce? Also do the tenders come with the mashed potatoes and rolls like the terms and conditions says?,2,2025-09-23 20:47:10,pay sauce tender come mashed potato roll term condition say,Positive
are the fried pickles still available???,It’s over but there might be some locations that have extras but I highly doubt it. We don’t have enough to get through the promotion over here at PNW area,1,2025-08-16 21:10:28,location extra highly doubt enough promotion pnw area,Neutral
Still more sanitary than KFC…,"Back when I used to work at KFC so many of those plastic totes of chicken from Tyson's would be spoiled as hell when we got them. 

I mean as soon as you pop the lid off  the smell would hit you hard and it was frozen. 

The sad thing was some people would say they couldn't smell it and just cook it anyway.",2,2025-07-05 13:19:50,many plastic tote chicken tyson spoiled hell mean soon pop lid smell hit hard frozen sad couldnt smell cook anyway,Neutral
How to make KFC,"Does this actually taste like KFC though, every time I've tried something that was meant to taste just like KFC it tasted nothing like it.",7,2025-07-28 12:50:56,taste though tried meant taste tasted nothing,Neutral
"Getting KFC today for the first time since 1998, what to expect from an 8 piece bucket and pot pies?",Last time I had KFC there was a literal puddle of grease at the bottom of the bucket,1,2025-07-26 04:29:47,literal puddle grease bottom bucket,Negative
Went to KFC to get the Stranger Things Burger just to be told they don’t have it in stock,"Shh, let people enjoy things",3,2025-12-27 12:57:21,shh let enjoy thing,Positive
"Miami, Florida KFC Menu on July 7, 2003",I expected it to be cheaper tbh.,1,2026-01-23 12:21:50,expected cheaper tbh,Neutral
I dont know if its inflation or me just going crazy. But this small combo meal costed me almost 16$. Including fountain drink.,Canada language laws are weird. ,1,2025-10-22 03:45:57,canada language law weird,Neutral
"Why are these the same price, if the one on the left is the same thing but with one less piece of chicken?",ask for two thighs. you will probably get it without an upcharge.,1,2025-06-05 01:25:49,ask two thigh probably without upcharge,Neutral
KFC Moist Towelette,Did this item (KFC Toilette Wipr) reveal anything of revelation to you?,1,2026-01-06 13:40:08,item toilette wipr reveal anything revelation,Neutral
I don’t like this timeline.,240687bd,1,2025-07-11 12:22:15,bd,Neutral
"Never tried the famous bowl, what could this be?",my only point is that they arent pure sugar lol. personally they dont affect my blood sugar any differently from any other fibrous carbs lol as a diabetic,4,2025-10-07 03:11:30,arent pure sugar personally affect blood sugar differently fibrous carbs diabetic,Neutral
Why KFC doesnt advertise their 11 secret herbs and spices anymore?,"That's right used to be finger licking good up until the 90s where the spices stick in your hands, now it's just MSG salt and pepper. Yum brands got rid of the 11 herbs and spices because it's deceptive and already proven by different scientific studies. They could be liable for litigation for false advertisement so they just use ""original recipe"".",1,2025-08-18 16:27:06,right finger licking spice stick hand msg salt pepper yum brand rid herb spice deceptive already proven different scientific study could liable litigation false advertisement original recipe,Positive
"Please, for the love of my sanity, STOP THE YOUTUBE COMMERCIAL!","I'll believe you. I will not click that link, thanks. But thank you sharing!",1,2025-08-27 18:02:35,ill believe click link thanks thank sharing,Positive
Should I eat the pistachio egg tart from kfc?,Why don't you just buy some pistachios at a supermarket instead of asking strangers on the internet. 🤦,1,2025-07-24 19:11:23,buy pistachio supermarket instead asking stranger internet,Neutral
Is KFC getting worse over the years?,Canes chicken is overrated. Honestly I go for the Texas toast and the canes sauce 😂😂,1,2025-11-17 18:51:27,cane chicken overrated honestly texas toast cane sauce,Neutral
KFC AUSTRALIA,"Ohh okay do you know how I go about that, because I’m trying to do it again through the website and it’s not allowing me to because I’ve applied recently",1,2025-06-10 10:05:00,ohh trying website allowing applied recently,Neutral
Bring back the DOUBLE DOWN,Which countries can you currently get it in?,2,2025-12-12 05:33:22,country currently,Neutral
Has KFC gotten worse than how it was 20 years ago?,"The confounding thing about KFC to me is how shitty the mashed potatoes are. Instant mashed potatoes at home are now much better than KFC’s mashed potatoes, which taste about the same (which means “watery”) as they have for 20 years and that doesn’t make any sense at all, where’s your product development division, KFC?",1,2025-11-08 17:26:09,confounding shitty mashed potato instant mashed potato home mashed potato taste mean watery year sense wheres product development division,Negative
Bring back popcorn chicken you cowards!!!!!,Not gonna lie. It's hard for me to favor keeping the nuggets seeing as the nuggets are to blame for popcorn chicken going away.  Everytime I see a picture of those nuggets it's like seeing a big middle finger.,1,2025-06-11 21:03:30,gonna lie hard favor keeping nugget seeing nugget blame popcorn chicken away everytime picture nugget seeing big middle finger,Neutral
KFC US pricing is shocking me..,Always use apps.. it is cheaper on apps get lots of deals and you dont have to wait in store..most of the combos have items you want if u remain  a bit flexible like eg get a medium fries in combo instead of large fries individually.. I never ever buy off the menu board in store.. like ever.. also with apps you get points which can later be used  to get free food.,1,2025-10-14 15:15:09,apps cheaper apps lot deal wait storemost combo item remain flexible eg medium fry combo instead large fry individually never ever buy menu board store ever apps point later free food,Neutral
KFC,"You’re right, but with lower prices = lower quality, and I can’t imagine the chicken getting any worse than what it already is. ",1,2025-07-02 22:05:35,right lower price lower quality imagine chicken getting worse already,Negative
Free 3 piece code worked for me today,Did you have to punch in a code or anything?,1,2025-11-07 20:14:31,punch code anything,Neutral
Seriously. This is 8 pieces??,Question: Is there 8 pieces of chicken in the bucket? If so then why are we here?,1,2025-07-18 14:03:19,question piece chicken bucket,Neutral
Cost of Large Coleslaw?,Why even eat at that going down hill restaurant? There are so many other choices.,1,2025-11-29 17:38:53,eat hill restaurant many choice,Neutral
Serious question: Do people actually prefer the new Famous Bowls?,Someone tell KFC to sell the gravy to Grocery stores and just close.,1,2026-02-26 09:38:56,tell sell gravy grocery store close,Neutral
This is the current state of a zinger burger....,wtf,1,2026-02-28 20:21:07,wtf,Neutral
What are these locations? Most of them are combos,"Canton, ct has KFC/Taco Bell",1,2026-01-22 10:20:11,canton ct kfctaco bell,Neutral
Fun Fact: You can crash the self-order kiosks easily,"I’ve been to KFC once this year and the same thing happened to me, has to be a common issue",1,2025-06-07 05:45:50,happened common,Neutral
I took full advantage of their free delivery promotion and got a order completely free 😎,If criticism optional or compulsory?,0,2025-05-16 20:18:17,criticism optional compulsory,Neutral
Nashville Hot Chicken,"They actually did… thank you so much, Xia!",1,2026-02-21 19:38:50,thank xia,Positive
"When did KFC do away with the keel (or ""center cut"")","it’s called a breast or center breast piece in AUS, if that helps. And yeah unfortunately theres like 2 breast pieces per bag of chicken compared with 5 of the other pieces so we simply don’t have many on hand due to how they’re packaged and cooked",2,2025-09-09 11:52:44,called breast center breast piece au help unfortunately there breast piece per bag chicken compared piece simply many hand due packaged cooked,Negative
Has anyone experienced this when ordering at a KFC?,"Maybe they blacklisted KFC for 4 years and was wondering if they should give them business again?

This is what I do to shitty sit-down restaurants. Give them a couple of chances over a few months time, sometimes you’re understaffed or what not. But when it becomes a pattern, nope, blacklisted. I don’t complain, still tip the servers properly, but I just never go back, for years. 

Friend wants to go there. “Nah mate, service is terrible, let’s go somewhere else”. 

Eventually, most of the places I’ve blacklisted have gone out of business. I think there’s still two around and after six years, I gave them another shot. Would go back. I guess they finally got their shit together.",2,2025-08-28 01:57:18,maybe blacklisted year wondering give business shitty sitdown restaurant give couple chance month sometimes understaffed becomes pattern nope blacklisted complain tip server properly never year friend want nah mate service terrible let somewhere else eventually place blacklisted gone business there two around six year gave another shot guess finally shit together,Negative
WTF is KFC USA doing with its pricing?  The more of an item you buy the more it costs per piece (or volume).  Not for everything but for some things.,They had an advertisement for the dippers for like $7. the only thing my local kfc had was a $20 meal. And it was a huge ripoff. Didnt even come with large sides,1,2025-05-01 15:16:53,advertisement dipper local meal huge ripoff come large side,Negative
Virginia KFC Sunrise,Wow it's gorgeous !,1,2025-07-06 21:31:05,wow gorgeous,Neutral
THERE RECIPE RARARAR,Chicken has been below average for years.,1,2025-11-21 19:19:27,chicken average year,Negative
Which decade of KFC do you think is the BEST decade?,"Hahahah absolutely dumb. We wanna hear fried. It's delicious, or it was on the 80s/90s. It's still not too bad. Fried is the golden word lol yumm. Moderation is all",3,2026-01-27 06:59:39,hahahah absolutely dumb wanna hear fried delicious s fried golden word yumm moderation,Positive
"On Wednesdays, is it possible to order an extra fried steak without ordering a whole new meal?","I just read up on this whole ""wire tapping"" fiasco. The Obama admin subpoenaed phone records of dozens of journalists because a story was reported on about a secret operation that happened in the Middle East. Way before it was ever announced to the public. So when you say ""wire tapped the parents of journalists"" is just ignorant. It was a matter of national security. The admin was working in the best interests of the country and the men and women over seas. So please let me know if you have anything else to say or if you think I'm wrong about anything. I could probably say a bunch of shit trump has done that's been illegal that wasn't in the best interest of the country or the men and women over seas. 

I hope you do respond. I'd like a discussion about this.",1,2025-10-31 05:53:42,read whole wire tapping fiasco obama admin subpoenaed phone record dozen journalist story reported secret operation happened middle east ever announced public wire tapped parent journalist ignorant matter national security admin working best interest country men woman sea please let anything else wrong anything could probably bunch shit trump done illegal wasnt best interest country men woman sea hope respond discussion,Negative
Stranger Things Double Down is actually a W move,This had close to 30 grams of trans fat when they first introduced this at KFC.,1,2025-12-06 22:44:54,close gram trans fat first introduced,Neutral
Worker representing KFC with a Confederate flag hat,Try to wear a Swastica in Germany. Try to make jokes about the suicide forest in Japan on YouTube. Many places actually have decency standards that really shouldn’t need to be said but I guess they never planned for people of your unique thinking ability,4,2025-07-24 15:22:04,try wear swastica germany try joke suicide forest japan youtube many place decency standard shouldnt guess never planned unique thinking ability,Negative
Ignore if want just a rant,what in the world are you rambling about?,1,2025-07-06 23:20:52,world rambling,Neutral
Ate an uncooked KFC burger from DoorDash — stomach felt weird,Your stomach ain’t gonna hurt that quickly get over it,0,2025-12-13 01:25:26,stomach aint gonna hurt quickly,Neutral
It was fun while it lasted.,Yes! I liked it better than Popeyes.,5,2025-11-04 21:33:08,yes liked popeyes,Neutral
The KFC Foundation,OP doesn't know what they are talking about. The Round Up program funds a variety of scholarship opportunities and hardship resources for KFC employees. It has nothing to do with homeless kids or in store maintenance.,2,2026-03-19 21:09:13,talking round program fund variety scholarship opportunity hardship resource employee nothing homeless kid store maintenance,Neutral
Please bring back the KFC buffet for 2026 or 2027 ASAP!,"Omg, I went to my one and only KFC buffet probably sometimes in the 90's. It was an amazing experience because I used to LOVE KFC. It's been years since I've bought anything from them due to the changing quality, quantity, and price. But I remember, as a (fat) kid, hitting a KFC buffet in Lake George NY and just being in heaven.",1,2026-01-29 01:55:05,omg buffet probably sometimes amazing experience love year since bought anything due changing quality quantity price remember fat kid hitting buffet lake george ny heaven,Positive
Am I the only one?,Thank you stay up 🙏,3,2025-04-17 02:35:10,thank stay,Positive
This was f*cking bomb af,Yikes,1,2025-06-07 01:51:44,yikes,Negative
What to do if you haven't given me a refund for almost a month?,Call up the store you ordered from.,5,2025-06-06 00:42:36,call store,Neutral
Australian KFCheads: is the Fried Cookie Dough promotion KFC's biggest fumble of the year?,"Interesting perspective, thanks for weighing in. I'm out in the country, a few hundred K's from Sydney - I'm glad to hear some folks were enthused for the fried cookie dough, even if I wasn't super there for it 🤙",1,2025-11-22 07:42:48,interesting perspective thanks weighing country hundred k sydney glad hear folk enthused fried cookie dough wasnt super,Positive
The $3.99 chicken sandwich deal may have ended but...,We got 4pc combos going for 12.99 CANADIAN on the app,1,2025-11-09 12:50:04,pc combo canadian app,Neutral
Why is it 27 dollars for 8 pieces od chicken?,"The five piece meal is 15
The taste of KFC was the 26 dollar one and it’s 14 pieces",3,2025-09-27 04:25:53,five piece meal taste dollar piece,Neutral
Canadian kfc fries,"They're certainly better than they were some years ago.
Especially when they're served hot which is sadly not not always the case.",3,2025-11-14 07:54:27,certainly year especially served hot sadly case,Negative
Stop ruining my life.,My condolences ⚰️ ,2,2026-03-14 23:32:53,condolence,Neutral
No regular full fat Pepsi? WTF!?,"im sure you kept smoking till 1965

because it wasn't conclusive

I guess you glossed over the 'growing body of evidence' line",2,2025-11-10 15:03:11,sure kept smoking till wasnt conclusive guess glossed growing body evidence line,Neutral
Fuck kfc it’s gotten expensive and bad,"I go to Angeles fried chicken in Angeles city Philippines at least 3 times a week. 

It tastes like KFC used to in the 70s with fresh mashed potatoes, coleslaw and rolls with butter not biscuits. 

Price for a 3 piece, 2 sides, roll and a soda is under $8.

So glad I found this place.",1,2026-02-22 12:41:54,angeles fried chicken angeles city philippine least time taste fresh mashed potato coleslaw roll butter biscuit price piece side roll soda glad found,Positive
WTF is KFC USA doing with its pricing?  The more of an item you buy the more it costs per piece (or volume).  Not for everything but for some things.,DoorDash ups the prices of everything. Those aren’t true to the real prices,2,2025-05-01 15:08:25,doordash ups price arent true real price,Neutral
Shifts feel soooo long,What are you going to do when you have to work full time?,3,2025-06-12 11:08:50,full,Neutral
Found these at Dollar General!,Didn’t know kfc had jellybeans 😮,1,2026-02-24 00:05:01,jellybeans,Neutral
Potato Wedges Return on 8.18,Like 2.99 for individual sized portion,1,2025-08-11 08:30:13,individual sized portion,Negative
"when your ""fancy meal"" is kfc but it's legit the best thing you've eaten all month.","It sucks [because we live in a shithole](https://www.instagram.com/reel/DC-Qv1dyojo/?igsh=Y3ozb28yYmd2OHBm) and every other country has the decency to properly raise actual livestock. Btw, what is in the link is how they make dog food, grains for feeding other livestock, etc",0,2025-06-30 18:42:12,suck live shithole country decency properly raise actual livestock btw link dog food grain feeding livestock etc,Negative
This was f*cking bomb af,It was bomb,1,2025-06-07 15:41:21,bomb,Neutral
Why is pespi max so popular?,Not anymore for over a year now Sunkist is also sugar free and constantly available,3,2025-08-15 01:11:46,anymore sunkist sugar free constantly available,Neutral
Kfc is best among all,"Why does American fast food look amazing, everywhere except for in America?",1,2026-03-16 22:06:59,american fast food amazing everywhere except america,Positive
lmao just the official kfc randomly commenting on an obscure post,Great maybe they can get 2 biscuits,1,2026-03-05 18:17:16,great maybe biscuit,Positive
Are you f’ing kidding me??!?,You’re definitely getting ripped off. I am very seldom if ever go anywhere except home to eat. It’s such a rip off at all fast food places anymore like Dairy Queen a large ice cream cone at Dairy Queen cost $5 USD,1,2025-12-01 15:14:15,definitely getting ripped seldom ever anywhere except home eat rip fast food place anymore dairy queen large ice cream cone dairy queen cost usd,Negative
A bit disappointed,"Wow I must be lucky to have a good KFC in my hometown, every time I order a snackbox - or anything really - they always give a good amount of chips etc",2,2025-06-04 09:11:18,wow must lucky hometown snackbox anything give amount chip etc,Positive
ZINGER MAX (5 layer chicken sandwich ),More like 21 and 29 tbh,1,2026-03-21 07:59:10,tbh,Neutral
Is this normal?,"I know, 2 bites and it was gone",2,2025-05-19 14:43:52,bite gone,Neutral
