Post Title,Comment,Upvotes,Timestamp,Tokenised_Comment,Manual_Label
How will it be like working at KFC?,"Do they hire 22 year old ? Or is it like MC Donald's only 16 to 21 ?

Going to get interviewed I don't want to build up any hopes, that's why 
Thank you",0,2026-02-07 04:27:25,hire old mc donalds interviewed build hope thank,Positive
Have you guys ever experienced the glorious all you can eat KFC buffet?,"I went to one near Bristol, CT. It was the only one I've ever seen. It was an experience for sure lol",3,2025-08-27 13:25:35,near bristol ct ever seen experience sure,Neutral
"Whats your order at KFC, be honest.",Chicken tenders mac and cheese as side and dr pepper most likely for drink and biscuit,2,2026-01-11 08:44:19,chicken tender mac cheese side dr pepper likely drink biscuit,Positive
Got this all today from KFC.,"nasty ass fries , BRING BACK POTATO WEDGES",2,2025-05-04 15:09:58,nasty as fry bring potato wedge,Negative
Are you f’ing kidding me??!?,Looks better than those unwashed fingerless gloves under your table 🤣,1,2025-11-30 00:52:29,look unwashed fingerless glove table,Neutral
country fried steak,It's been Wednesday only for years in Utah,2,2026-01-25 20:11:42,wednesday year utah,Neutral
KFC US pricing is shocking me..,"I ordered two breast pieces and a large family size order of fries yesterday, total was $7.24 with tax. because I had a coupon for a free order of fries.",2,2025-10-13 13:56:32,two breast piece large family size fry yesterday total tax coupon free fry,Neutral
Can they keep these on the Menu Forever?,Because the food was bad I told him to tone down the salt on my food in the back. I dig as an archeologist for a living. I don't think he understood the concept of a job.,1,2026-02-13 16:01:40,food told tone salt food dig archeologist living understood concept job,Negative
Free Food!,Everyone took it 😔✌,1,2025-12-13 21:01:20,took,Neutral
Australia KFC - Food item idea,No they really need to work on their desserts and drinks before any other food item. Bring back the krushers or something,2,2025-06-07 09:57:11,dessert drink food item bring krushers,Negative
"Guys, is it just my illusion? Why it looks so few now?",That chicken looks amazing btw ,28,2026-01-13 19:00:48,chicken look amazing btw,Positive
KFC Pot Pie,I love this it's my favorite fast food item,3,2025-12-03 19:39:34,love favorite fast food item,Positive
Toothpaste has arrived,Remind me 5 hours,1,2025-04-24 21:31:23,remind hour,Neutral
Can you get the don pollo meal outside of Spain??? I'm in ireland,I live on the border of spain 🇪🇸 in france 🇫🇷 and we have it in my city but not other country no,1,2025-06-12 14:09:37,live border spain france city country,Neutral
I hate KFC now,They’ve been that (pathetic) size for a few years now. Haven’t they??,1,2026-02-26 00:08:29,theyve pathetic size year,Negative
First time trying KFC in 2026!! Five stars to the chicken of the 4 piece combo! :) 😋,"Ahh yup, checks out. Too rich for my cheap blood :p",3,2026-03-01 23:06:45,ahh yup check rich cheap blood,Neutral
Is that it? 🤣,No one sent him any death threats over freaking French fries.  He's making that up just like he's lying about the fries,2,2026-01-11 10:44:01,sent death threat freaking french fry he making he lying fry,Neutral
is this raw-,Cooked. Don't listen to the people talking about colour - Amateur chefs that think pink chicken always means raw.,3,2025-12-15 04:52:58,cooked listen talking colour amateur chef pink chicken mean raw,Neutral
About to have a mad feed at KFC,This is a Wendy's Sir!,1,2025-12-18 04:57:15,wendys sir,Neutral
How do you even rationalize coming here anymore?,"apps are a pariah

if they can't have a daily menu in the store for a sale, they can eat crap",1,2025-11-18 15:34:00,apps pariah daily menu store sale eat crap,Neutral
No regular full fat Pepsi? WTF!?,"""given the **limited and conflicting data** available, these findings can at the present time be considered only suggestive, ***not conclusive***\*,\* but they warrant further investigation in other prospective studies with data on long-term intake of soft drinks, diet soft drinks, and aspartame.""

  
Sorry, but 3 studies with no conclusive evidence is not proof that diet soda causes cancer.

  
The list of things ""possibly carcinogenic to humans"" is a mile long, and none of them are definitively carcinogenic to humans.",0,2025-11-10 14:49:08,given limited conflicting data available finding present considered suggestive conclusive warrant investigation prospective study data longterm intake soft drink diet soft drink aspartame sorry study conclusive evidence proof diet soda cause cancer list thing possibly carcinogenic human mile long none definitively carcinogenic human,Neutral
I took full advantage of their free delivery promotion and got a order completely free 😎,And you sound like someone who is trying to feel cool about being broke,1,2025-05-17 02:58:40,trying cool broke,Neutral
This 10 piece Chicken bucket must be a piss take. 8 Drumsticks...,"my occasional (maybe every three months or so if i remember) visit for one promotional item def keeps them in business, you cracked the case 😍",1,2025-07-04 00:31:39,occasional maybe three month remember visit promotional item def keep business cracked case,Neutral
Are you f’ing kidding me??!?,All Arabs are semites too.,1,2025-12-04 07:26:19,arab semite,Neutral
Is kfc real chicken,"No, it isn't real chicken. It is actually beef that has been compacted into the shape and feel of chicken around artificial bones created by CIA scientists in an effort to fund paramilitary death squads in barbados with your fried chicken money. Stay awake, America!",2,2025-05-18 14:54:57,real chicken beef compacted shape chicken around artificial bone created cia scientist effort fund paramilitary death squad barbados fried chicken money stay awake america,Negative
My local KFC. Have you ever seen a KFC like this?,Yes all the time n word,0,2025-08-21 03:12:27,yes word,Neutral
Is KFC getting worse over the years?,"Well my mother said it was soggy when she went recently. That was my experience last time I went as well, plus they messed up my order.",1,2025-11-13 09:45:11,mother soggy recently experience plus messed,Negative
Will the KFC Double Down sandwich make a comeback in 2026?,Owned that bozo KFC king,3,2026-01-28 01:21:27,owned bozo king,Neutral
THERE RECIPE RARARAR,"yeah we dont do that , you open the bags , dump the chicken into a bucket then pour it into a basket and drain it over a bucket of water , the second time we dip it in water then drain over the bucket",1,2025-11-21 15:43:41,open bag dump chicken bucket pour basket drain bucket water second dip water drain bucket,Neutral
Zinger Sandwich is back on the menu in the US!,What's the diff with this and the chicken sandwich?,1,2026-01-11 04:13:29,whats diff chicken sandwich,Neutral
My interview got cancelled 😞,You do realize that’s racist,-1,2025-06-02 05:25:42,realize racist,Neutral
Just saw the prices,You don't go anywhere without giving your data away?   ,1,2026-03-17 19:36:43,anywhere without giving data away,Neutral
Man I just wanted to share some good food with you all~,I wish they would bring the Snackers back.,1,2025-05-10 00:55:13,wish bring snacker,Negative
8pc (free) comeback deal,"Tell me how it tastes, come from France, love the KFC there, so tasty",1,2025-07-19 05:28:10,tell taste come france love tasty,Positive
Setting up your availability in AUS,The rosters are made to start tuesday and end on the next tuesday and get paid for the fortnight of work youve done on the wednesday the day after. Nothing wrong you can just set it from tuesday,1,2025-09-08 08:18:26,roster made start tuesday end next tuesday paid fortnight youve done wednesday nothing wrong set tuesday,Negative
Just had kfc in Nairobi and holy shit were getting ripped off in the US,"At 500 average monthly wage (google numbers), it should cost much less too..",1,2025-09-17 17:30:25,average monthly wage google number cost less,Neutral
kfc australia - how to link discount card to the app,And to use it just go to check out and it should automatically attach to every order you buy on the app,2,2025-10-25 04:37:43,check automatically attach buy app,Neutral
Kfc festive fizz,the festive wraps are sooo fire,1,2025-12-31 01:14:20,festive wrap sooo fire,Positive
(UK) 60pc popcorn chicken,Can I ask a daft question - how do you portion that up? I assume you aren’t counting. Is there like a fill line on the container or something?,1,2025-08-07 16:53:45,ask daft question portion assume arent counting fill line container,Negative
KFC in Philippines has Popcorn Chicken. Why not USA?,Kfc the brand is from the USA yes. There are Scottish recipes from at least 1747.,1,2025-09-18 18:16:18,brand usa yes scottish recipe least,Neutral
i can see why kfc was hiring cooks,"worked at kfc as a crew member. can confirm a lot of standing around. can also confirm any kfc you work at the management is going to be a dumpster fire, over hire, bitch and fire ayyyyyy. na fr though they over hire cut hours domt teach new employees shit get mad at the new employees for not doing shit when they never even taught them shit. make new employees not wanna work anymore so call off or quit either way end up getting fired and the cycle repeats. if your opinion is ever voiced you’ll be shunned by the cult and its following we call management.",1,2025-05-24 15:25:56,worked crew member confirm lot standing around confirm management dumpster fire hire bitch fire ayyyyyy na fr though hire cut hour domt teach employee shit mad employee shit never taught shit employee wanna anymore call quit either end getting fired cycle repeat opinion ever voiced youll shunned cult following call management,Negative
KFC Gravy Contents?,"You can search on Google or go to the website for kfc..





KFC gravy's key ingredients include wheat flour, modified food starch, maltodextrin, chicken fat, salt, partially hydrogenated soybean oil, MSG, and flavorings like onion powder, natural flavors, and caramel color, plus thickeners, proteins, and anti-caking agents for texture and taste, creating a savory, slightly meaty flavor base with common allergens like wheat, soy, and milk, as listed in their official ingredient breakdown.",1,2026-01-17 23:23:04,search google website gravy key ingredient include wheat flour modified food starch maltodextrin chicken fat salt partially hydrogenated soybean oil msg flavoring onion powder natural flavor caramel color plus thickener protein anticaking agent texture taste creating savory slightly meaty flavor base common allergen wheat soy milk listed official ingredient breakdown,Neutral
Want popcorn chicken,"They didn't make something they didn't have??? How rude! 😂😂😂

Where was he supposed to get it from? Chew some tenders and spit them out than fry that for you? Or maybe you wanted to wait until he sh@ts them out? People who don't understand ""sorry we don't have that"" are the ones safety instructions like ""don't put your baby in the washing machine"" are made for... please do the poor staff a favour and keep your promise of not returning to that location (or any other fast food/ restaurant until you found yourself some common sense).

If you're in the US you have to leave your country to get some popcorn chicken. A flight to the UK for example, but maybe Canada will do as well (I don't know their menu, so double checking it is advisable)...",1,2026-02-18 16:11:02,rude supposed chew tender spit fry maybe wanted wait shts understand sorry one safety instruction put baby washing machine made please poor staff favour keep promise returning location fast food restaurant found common sense u leave country popcorn chicken flight uk example maybe canada menu checking advisable,Positive
Stranger Things Burger,since the 90's you're a few decades late bro,1,2025-11-21 20:39:33,since decade late,Neutral
What's your go-to order?,chcken,1,2026-01-14 05:09:41,chcken,Neutral
I ordered a kfc meal from the Kfc app around 9:15 pm it showed the arrival time as 10:00 pm. It is 10:56 pm now and the order hasn't arrived yet,We will get right on it and you will receive an extra 12-piece bucket as our apology to you.,5,2025-12-31 17:30:08,right receive extra piece bucket apology,Neutral
£13:50 for this was pretty depressing,"You're paying for overhead, that's the remainder",1,2025-05-17 04:46:30,paying overhead remainder,Neutral
I came I saw I conquered 7 portions of fry’s/chips what’s up with y’all,I’ll never forgive KFC for getting rid of wedges,5,2025-12-06 22:48:18,ill never forgive getting rid wedge,Neutral
Is my gravy supposed to be iridescent like motor oil? Lol I started feeling sick after eating this and now I’m worried,What a day to be able to read lmao,1,2026-02-13 19:19:57,able read lmao,Negative
A bit disappointed,You keep paying for fake chicken they keep serving it.,0,2025-06-01 01:24:53,keep paying fake chicken keep serving,Neutral
Wtf?,"Oh please believe me. 

I need your validation more than I need oxygen",1,2026-01-19 19:23:47,please believe validation oxygen,Positive
Just saw the prices,"we still have the $5 value meal which is 2 dark pieces , mash and a biscuit",2,2026-03-15 05:20:46,value meal dark piece mash biscuit,Neutral
Got this all today from KFC.,Just got some good skills!,2,2025-05-02 17:31:32,skill,Positive
Idk if this is allowed here.,Which one? I know Highbury has terrible service,3,2025-11-13 00:32:28,highbury terrible service,Negative
What da F****,"nutty toy crush outgoing insurance placid connect theory tease fuzzy

 *This post was mass deleted and anonymized with [Redact](https://redact.dev/home)*",1,2025-12-24 23:47:03,nutty toy crush outgoing insurance placid connect theory tease fuzzy post mass deleted anonymized redact,Negative
£13:50 for this was pretty depressing,KFC are taking the piss for that trash,1,2025-05-17 20:07:01,taking piss trash,Negative
‘92 coupons,CAD. Not USD.,1,2025-11-12 10:09:30,cad usd,Neutral
okay. fine..,"Oh, thats all of my gf ¯\_(ツ)_/¯ (ex)",2,2025-07-05 16:15:37,gf ex,Neutral
Cook is on break,An hour and a half before close is unacceptable. I am a closing manger as well so I know how much extra work they have. You should still have at least a dozen pieces of chicken up. I was told I couldn't even get a pot pie or anything what so ever.,-4,2025-07-17 02:41:01,close unacceptable closing manger extra least dozen piece chicken told couldnt pot pie anything ever,Negative
8 piece nugget,Super nug....or crumb. Lol,1,2025-09-23 00:59:07,super nugor crumb,Neutral
"Whats your order at KFC, be honest.",If they would bring their wraps back my big back would eat them everyday,4,2026-01-11 15:57:07,bring wrap big eat everyday,Neutral
Felt cheated,When does fast food ever lol. Half the time they use fake food for a reason,8,2026-03-15 23:32:11,fast food ever fake food,Neutral
Poke bowl,You guys kill me when you say things are much better somewhere else.  Just because you can’t get poke at kfc here in the US doesn’t mean you can’t get good food somewhere else including great poke shops all over.,1,2026-02-21 10:18:21,kill thing somewhere else poke u mean food somewhere else including great poke shop,Positive
I dont know if its inflation or me just going crazy. But this small combo meal costed me almost 16$. Including fountain drink.,"Might wanna take your own advice. It's ironic that you're crusading against 'venom' yet you call someone a bitch. 

Wasn't that serious in the first place. Also, it's pretty weird to post that on your alternate account and then immediately upvote yourself 10 seconds later on an obscure day-old KFC thread. It was obviously you. 

If it bothered you that much that you have to log into another account and then upvote yourself, you should probably take a break from reddit and go outside.",3,2025-10-21 15:58:05,wanna take advice ironic crusading venom yet call bitch wasnt serious first weird post alternate account immediately upvote second later obscure dayold thread obviously bothered log another account upvote probably take break reddit outside,Neutral
KFC,Would you go to KFC any other day for an 8 piece meals besides tuesdays?,2,2025-07-02 22:02:14,piece meal besides tuesday,Neutral
My 6 dollar meal,"Not bad for 6 bucks. I'd pay it. Got Mcds big mac value meal, the other day, and no meat. Never again. It was 5 bucks on the app.",1,2026-01-15 18:09:05,buck pay mcds big mac value meal meat never buck app,Negative
Would you pay $15 for this?,Robbery! I would not stand for the chopped up chicken,1,2026-02-16 07:51:11,robbery stand chopped chicken,Neutral
"Admittedly, I do you like the macaroni. What about you? What's your favorite side? I think the macaroni has been a comfort side for me since I was a little kid.","And How did you cook the Ex Crispy?  
Im trying to copycat it with the spice mixture I remember as a kid; even though this topic is about mac and cheese, any anecdotal information would be helpful",2,2026-02-18 05:55:14,cook ex crispy trying copycat spice mixture remember kid though topic mac cheese anecdotal information helpful,Positive
Which decade of KFC do you think is the BEST decade?,"Lard my friend, lard

and chicken skin",1,2026-01-29 08:33:56,lard friend lard chicken skin,Neutral
North Korea has their own “KFC”,Yeah but a lot of North Korea is one big jail. Modern day horrors happen there.,1,2025-09-16 10:21:35,lot north korea big jail modern horror happen,Neutral
KFC is trash and their prices are now offensive,I love your username,1,2025-12-12 08:24:16,love username,Positive
"Never tried the famous bowl, what could this be?","That's the famous bowl. That's what it is. That's literally just what it is. It's what you ordered, garbage.",1,2025-10-07 06:35:45,famous bowl literally garbage,Negative
KFC quality in hungary,Colonel corn flake Sanders,2,2025-11-27 01:43:28,colonel corn flake sander,Neutral
What’s your all time fav KFC item?,Nashville Hot chicken tenders and potato wedges.,1,2026-02-08 21:35:08,nashville hot chicken tender potato wedge,Positive
🇭🇰,"Left wing, yes. ",1,2026-03-24 20:52:38,left wing yes,Neutral
The 7 dollar tender fill up that I ate earlier for lunch today. Really tasty and delicious!,"Nope, domino's has 2 mediums for $9 each, they often have 50% off any pizza, Harvey's has $3 original burger, etc.",1,2025-07-10 23:18:28,nope domino medium often pizza harvey original burger etc,Neutral
Nashville Hot Chicken,Nashville hot chicken and waffles was one of my favorite meals back when they were being offered.,1,2026-02-19 20:36:06,nashville hot chicken waffle favorite meal offered,Positive
KFC is trash and their prices are now offensive,"I gave them another chance with the gravy flight meal. The person taking my order had never heard of it. I’m like I see it on the menu in front of me…. After a hand off they got it. Got a large drink and that was like maybe a medium. They pulled me and the next two cars forward for “fresh fries.” 27 minutes later they come out and give my food to the other car. They drove off with my food and they had to remake my food. 41 minutes later I’m driving home. Food was mid, hour later we both had stomach aches. Never again.",2,2025-12-11 19:33:19,gave another chance gravy flight meal taking never heard menu front hand large drink maybe medium pulled next two car forward fresh fry minute later come give food car drove food remake food minute later driving home food mid later stomach ache never,Negative
why are regular chicken tenders spicy now,There’s a joke that white people can’t handle even a little bit of spice for some reason,0,2025-11-30 16:53:47,there joke white handle little spice,Negative
Kfc isnt good anymore,It’s so nasty now,2,2025-11-06 16:35:39,nasty,Negative
Bring back the DOUBLE DOWN,"Stranger Things burger is good twist on the original, maybe just for that relish in it? The apps secret menu, very briefly had a triple stack. Wasn't bad.",1,2025-12-12 17:42:49,stranger thing burger twist original maybe relish apps secret menu briefly triple stack wasnt,Neutral
I dont know if its inflation or me just going crazy. But this small combo meal costed me almost 16$. Including fountain drink.,I do indeed,1,2025-10-20 06:51:30,indeed,Neutral
Is the app busted? There's no confirm button,That didn't make a difference.,1,2025-10-06 15:43:07,difference,Neutral
£13:50 for this was pretty depressing,Taco Bell must be helping keep KFC afloat.,2,2025-05-17 18:25:29,taco bell must helping keep afloat,Neutral
Job interview,It's generally cheaper than most of europe,1,2025-11-19 17:54:38,generally cheaper europe,Neutral
why was 24 nuggets for $10 abruptly removed?,Today is I think boneless hot and crispy box deal,1,2025-10-21 03:17:26,boneless hot crispy box deal,Positive
KFC Hot dogs,Northern California,1,2026-01-24 20:58:32,northern california,Neutral
I dont know if its inflation or me just going crazy. But this small combo meal costed me almost 16$. Including fountain drink.,"Damn!
That 2pc is $8 here in Pittsburgh",1,2025-10-20 13:12:51,damn pc pittsburgh,Neutral
Wtf?,Haha,1,2026-01-15 20:30:23,haha,Neutral
Why KFC Canada is telling customers to use Delivery Services rather In Store pick up?,"Prolly an attempt at reaching more customers who think KFC is too far away to pick up for their family.

I grew up going to a KFC like 5min away from us. The second it closed, we pretty much stopped going to KFC even though another one was 20min away. The issue with 20min away, is it's a 40min round trip. It wasn't worth it.",7,2025-10-15 18:35:48,prolly attempt reaching customer far away pick family grew min away u second closed stopped though another min away min away min round trip wasnt worth,Negative
Had a whole ass drumstick bone in my chicken stacker burger. Nearly broke my teeth in it,"This would 100% destroy my teeth, my teeth are fucked right now and biting into this full force. Man idk what I would do",2,2025-05-22 16:06:24,destroy teeth teeth fucked right biting full force idk,Negative
Found these at Dollar General!,"These look utterly horrendous.

... 

I need to try a bag",2,2026-02-18 06:09:04,utterly horrendous try bag,Neutral
I came I saw I conquered 7 portions of fry’s/chips what’s up with y’all,"You're going in crystal, dawg. We sealing you in the fucking orb.",5,2025-12-06 22:53:14,crystal dawg sealing fucking orb,Negative
"Longest-serving KFC worker, 74, dies after selling millions of drumsticks",Chitty situation ,1,2025-07-21 20:35:18,chitty situation,Neutral
"You guys, the stuffing",Their stuffing tastes EXACTLY like the stove top stuffing out the box (which I love lol) so I have no problems with it,2,2025-12-29 22:34:46,stuffing taste exactly stove stuffing box love problem,Positive
This is a crock of crap,Buying soft drinks at any fast food joint is stupid. ,-11,2025-08-02 23:50:08,buying soft drink fast food joint stupid,Negative
Southwest Cheddar Gravy,"Its queso gravy , tastes like a nacho cheese dip to me .",1,2025-12-26 02:08:43,queso gravy taste nacho cheese dip,Neutral
My interview got cancelled 😞,Judging by the grammar they are a desi owned KFC in which case they probably hired a similar person instead. At least in my area desi owned franchises usually hire friends and other desi people. There's a burger King that won't hire whites in my city,1,2025-06-01 17:09:34,judging grammar desi owned case probably hired similar instead least area desi owned franchise usually hire friend desi there burger king wont hire white city,Neutral
Found these at Dollar General!,"I have a cousin who lives in AZ and he swears by these. He overnighted me six bags not too long ago telling me I need to try them. I threw them in the trash. He said they taste just like real KFC. His now ex-fiancé was cheating on him with his co-worker from the construction site for 3 months before he found out, that’s why he lives in AZ now and still swears by these jelly beans. I don’t know who would ever try them.",1,2026-02-17 23:23:17,cousin life az swears overnighted six bag long telling try threw trash taste real exfianc cheating coworker construction site month found life az swears jelly bean ever try,Negative
Are you f’ing kidding me??!?,"Yeah, it's crazy how it blew up like this. I was just joking around. 😂",1,2025-12-02 07:48:25,crazy blew joking around,Neutral
Why was Peter Griffin arrested at my store after I got fired?,I was drinking a little last night lol.,2,2025-10-26 17:34:06,drinking little night,Neutral
Felt cheated,What do u expect they saving every penny ,1,2026-03-18 17:56:55,expect saving penny,Neutral
Why is all the work dumped on the COOK at closing?,"True and i try to work hard thats the problem. They figured it out that “he is a hard worker so, let him work.” 
But everything has its limits. Might complain directly to DM and will get using phone restricted in the work area. Everyone in this branch is addicted to their phone. 
Sooner or later they will understand that they are not getting paid for watching tiktok!!!!!!!!!",1,2025-08-09 11:58:41,true try hard figured hard worker let limit complain directly dm using phone restricted area branch addicted phone sooner later understand getting paid watching tiktok,Positive
Went to KFC to get the Stranger Things Burger just to be told they don’t have it in stock,"Folks wanted to try the spongebob movie meal for Burger King (i didn't for other reasons)


Heck I tried some of the pickle menu items that came out during summer where im at for KFC and honestly I liked the loaded fries more than I thought i would.",1,2025-12-27 13:26:02,folk wanted try spongebob movie meal burger king reason heck tried pickle menu item came summer honestly liked loaded fry thought,Neutral
